qid,original_query,expanded_query
654,sex schools,"sex education schools curriculum students teaching health contraception abstinence AIDS"
655,add diagnosis treatment,"ADHD ADD attention deficit disorder children medication Ritalin diagnosis treatment hyperactivity"
656,lead poisoning children,"lead poisoning children exposure paint contamination health blood levels prevention screening housing"
657,school prayer banned,"school prayer banned Supreme Court religion First Amendment separation church state Engel"
658,teenage pregnancy,"teenage pregnancy teen mothers adolescent birth rates prevention education youth welfare"
659,cruise health safety,"cruise ship health safety illness outbreak norovirus sanitation passengers CDC inspection"
660,whale watching california,"whale watching California Pacific gray whales migration tourism boats ecotourism Monterey"
661,melanoma treatment causes,"melanoma skin cancer sun UV exposure treatment surgery prevention causes moles"
662,telemarketer protection,"telemarketing calls consumer protection do-not-call harassment privacy regulations FTC"
663,agent orange exposure,"Agent Orange Vietnam veterans herbicide dioxin health cancer birth defects VA claims"
664,american indian museum,"Native American museum Indian artifacts culture history Smithsonian NMAI collections repatriation"
665,poverty africa sub sahara,"Africa Sub-Saharan poverty hunger malnutrition development aid economic crisis famine drought"
666,thatcher resignation impact,"Thatcher resignation Margaret UK Prime Minister 1990 Conservative Party Britain poll tax"
667,unmarried partner households,"unmarried couples cohabitation households living together domestic partnership census statistics"
668,poverty disease,"poverty disease health illness developing countries malnutrition infectious mortality AIDS tuberculosis"
669,islamic revolution,"Islamic Revolution Iran 1979 Khomeini Shah theocracy Iranian Republic hostages"
670,elections apathy,"voter turnout apathy election participation democracy voting civic engagement low abstention"
671,salvation army benefits,"Salvation Army charity homeless assistance social services programs religious shelter"
673,soviet withdrawal afghanistan,"Soviet withdrawal Afghanistan 1989 Red Army mujahideen Cold War pullout Gorbachev"
674,greenpeace prosecuted,"Greenpeace prosecution environmental activism protests legal action arrests charges Rainbow Warrior"
675,olympics training swimming,"Olympic swimming athletes training competition medals world records sports Barcelona Atlanta"
676,poppy cultivation,"poppy cultivation opium heroin Afghanistan drug production narcotics eradication farming Pakistan"
677,leaning tower pisa,"Leaning Tower Pisa Italy tilt restoration architecture tourism landmark stabilization"
678,joint custody impact,"joint custody children divorce parents shared family law effects co-parenting visitation"
679,opening adoption records,"adoption records access birth parents sealed rights search reunion identity open"
680,immigrants spanish school,"bilingual education immigrants Hispanic students Spanish language schools learning ESL"
681,wind power location,"wind power location farm turbine siting renewable energy generation capacity offshore"
682,adult immigrants english,"ESL English immigrants adult education language learning literacy programs classes refugees"
683,czechoslovakia breakup,"Czechoslovakia breakup Czech Slovakia dissolution Velvet Divorce 1993 independence Prague"
684,part time benefits,"part-time workers benefits employment healthcare insurance wages compensation rights labor"
685,oscar winner selection,"Oscar Academy Awards selection voting members films actors nominees Hollywood best picture"
686,argentina pegging dollar,"Argentina peso dollar peg currency convertibility economic crisis devaluation Menem Cavallo"
687,northern ireland industry,"Northern Ireland industry economy manufacturing employment investment business development Belfast"
688,non media bias,"media bias news journalism objectivity reporting coverage political fairness liberal conservative"
689,family planning aid,"family planning aid foreign population programs contraception developing countries USAID"
690,college education advantage,"college education benefits degree earnings employment career graduates higher university"
691,clear cutting forests,"clear cutting deforestation logging forests timber environmental damage ecosystem spotted owl"
692,prostate cancer detection treatment,"prostate cancer PSA screening detection treatment surgery radiation therapy men biopsy"
693,newspapers electronic media,"newspapers print journalism media future digital electronic online decline circulation"
694,compost pile,"compost composting organic waste gardening soil fertilizer decomposition yard worms"
695,white collar crime sentence,"white collar crime sentence fraud embezzlement corporate punishment prosecution prison Milken"
696,safety plastic surgery,"plastic surgery safety cosmetic risks complications breast implants silicone procedures"
697,air traffic controller,"air traffic controller ATC aviation safety FAA airports radar flights PATCO"
698,literacy rates africa,"literacy Africa education reading writing rates schools development statistics illiteracy"
699,term limits,"term limits political office elected officials restrictions congress incumbents states referendum"
700,gasoline tax,"gasoline tax fuel prices transportation highway funding federal state revenue cents"
